{
  "case": "family-clock-range-breakout-gates-target",
  "costs": {
    "feePerUnit": 0,
    "fillOn": "close",
    "slippage": 0,
    "startEquity": 10000
  },
  "higherTimeframe": null,
  "rangeMethod": "zone",
  "schema": "dsl-conformance-trades-v1",
  "strategyId": "family-clock-range-breakout-gates-target",
  "symbol": "XAUUSD",
  "timeframe": "1h",
  "tradeCount": 1,
  "trades": [
    {
      "entry": 103,
      "entryIndex": 51,
      "entryT": 1772593200000,
      "exit": 109,
      "exitIndex": 52,
      "exitT": 1772596800000,
      "initialSl": 100,
      "initialTp": 109,
      "meta": {
        "clockRangeBreakout": {
          "dayKey": "2026-03-04",
          "exitReason": "target",
          "orderPlacedAt": 1772593200000,
          "rangeBars": 3,
          "rangeHigh": 103,
          "rangeLow": 100,
          "side": "long"
        }
      },
      "pnl": 200,
      "points": 6,
      "reason": "tp",
      "side": "long",
      "size": 33.3333333333333,
      "sl": 100,
      "tag": "DSL-CRB",
      "tp": 109
    }
  ]
}
