{
  "case": "research-dsl-session-break-hold-directional-target-fifteen",
  "costs": {
    "feePerUnit": 0,
    "fillOn": "close",
    "slippage": 0.06,
    "startEquity": 10000
  },
  "higherTimeframe": "1h",
  "rangeMethod": "zone",
  "schema": "dsl-conformance-trades-v1",
  "strategyId": "dslSessionBreakHoldDirectionalTargetFifteen",
  "symbol": "XAUUSD",
  "timeframe": "15m",
  "tradeCount": 5,
  "trades": [
    {
      "entry": 1284.125,
      "entryIndex": 1310,
      "entryT": 1548145800000,
      "exit": 1280.83121428571,
      "exitIndex": 1337,
      "exitT": 1548170100000,
      "initialSl": 1280.89121428571,
      "initialTp": 1288.5083,
      "meta": {
        "gradeRequired": 0,
        "gradeScore": 0,
        "levelKey": "AH",
        "levelPrice": 1281.468,
        "setup": "sessionBreakHold",
        "side": "long"
      },
      "pnl": -203.710821019147,
      "points": -3.2937857142856,
      "reason": "sl",
      "side": "long",
      "size": 61.8470169858425,
      "sl": 1280.89121428571,
      "tag": "DSL-SBH:AH",
      "tp": 1288.5083
    },
    {
      "entry": 1284.718,
      "entryIndex": 1598,
      "entryT": 1548415800000,
      "exit": 1283.41207142857,
      "exitIndex": 1604,
      "exitT": 1548421200000,
      "initialSl": 1283.47207142857,
      "initialTp": 1286.3183,
      "meta": {
        "gradeRequired": 0,
        "gradeScore": 0,
        "levelKey": "LH",
        "levelPrice": 1283.835,
        "setup": "sessionBreakHold",
        "side": "long"
      },
      "pnl": -209.631370750438,
      "points": -1.30592857142824,
      "reason": "sl",
      "side": "long",
      "size": 160.522845840774,
      "sl": 1283.47207142857,
      "tag": "DSL-SBH:LH",
      "tp": 1286.3183
    },
    {
      "entry": 1313.485,
      "entryIndex": 2700,
      "entryT": 1549969200000,
      "exit": 1313.467475,
      "exitIndex": 2709,
      "exitT": 1549977300000,
      "initialSl": 1312.32732142857,
      "initialTp": 1314.96175,
      "meta": {
        "gradeRequired": 0,
        "gradeScore": 0,
        "levelKey": "AH",
        "levelPrice": 1312.818,
        "setup": "sessionBreakHold",
        "side": "long"
      },
      "pnl": -3.02761067406699,
      "points": -0.0175249999999778,
      "reason": "sl",
      "side": "long",
      "size": 172.759524911316,
      "sl": 1313.527475,
      "tag": "DSL-SBH:AH",
      "tp": 1314.96175
    },
    {
      "entry": 1313.625,
      "entryIndex": 2773,
      "entryT": 1550038500000,
      "exit": 1312.54217857143,
      "exitIndex": 2776,
      "exitT": 1550041200000,
      "initialSl": 1312.60217857143,
      "initialTp": 1314.91295,
      "meta": {
        "gradeRequired": 0,
        "gradeScore": 0,
        "levelKey": "AH",
        "levelPrice": 1312.818,
        "setup": "sessionBreakHold",
        "side": "long"
      },
      "pnl": -211.732253221121,
      "points": -1.08282142857138,
      "reason": "sl",
      "side": "long",
      "size": 195.537553685533,
      "sl": 1312.60217857143,
      "tag": "DSL-SBH:AH",
      "tp": 1314.91295
    },
    {
      "entry": 1325.925,
      "entryIndex": 3075,
      "entryT": 1550493900000,
      "exit": 1327.22215,
      "exitIndex": 3079,
      "exitT": 1550497500000,
      "initialSl": 1324.85275,
      "initialTp": 1327.28215,
      "meta": {
        "gradeRequired": 0,
        "gradeScore": 0,
        "levelKey": "AH",
        "levelPrice": 1325.225,
        "setup": "sessionBreakHold",
        "side": "long"
      },
      "pnl": 241.949172301268,
      "points": 1.2971500000001,
      "reason": "tp",
      "side": "long",
      "size": 186.523665190031,
      "sl": 1325.96495,
      "tag": "DSL-SBH:AH",
      "tp": 1327.28215
    }
  ]
}
