{
  "case": "deployed-dsl-session-expansion-ny",
  "costs": {
    "feePerUnit": 0,
    "fillOn": "close",
    "slippage": 0.06,
    "startEquity": 10000
  },
  "higherTimeframe": "1h",
  "rangeMethod": "zone",
  "schema": "dsl-conformance-trades-v1",
  "strategyId": "dslSessionExpansionNY",
  "symbol": "XAUUSD",
  "timeframe": "15m",
  "tradeCount": 5,
  "trades": [
    {
      "entry": 1879.278,
      "entryIndex": 857,
      "entryT": 1604060100000,
      "exit": 1882.22997857143,
      "exitIndex": 858,
      "exitT": 1604061000000,
      "initialSl": 1876.54671428571,
      "initialTp": 1882.28997857143,
      "meta": {
        "gradeRequired": 0,
        "gradeScore": 0,
        "levelKey": "AH",
        "levelPrice": 1877.995,
        "setup": "sessionBreakHold",
        "side": "long"
      },
      "pnl": 216.160364035797,
      "points": 2.95197857142898,
      "reason": "tp",
      "side": "long",
      "size": 73.2255871122935,
      "sl": 1876.54671428571,
      "tag": "DSL-SBH:AH",
      "tp": 1882.28997857143
    },
    {
      "entry": 1888.518,
      "entryIndex": 940,
      "entryT": 1604314800000,
      "exit": 1891.92636428571,
      "exitIndex": 945,
      "exitT": 1604319300000,
      "initialSl": 1885.38985714286,
      "initialTp": 1891.98636428571,
      "meta": {
        "gradeRequired": 0,
        "gradeScore": 0,
        "levelKey": "AH",
        "levelPrice": 1886.705,
        "setup": "sessionBreakHold",
        "side": "long"
      },
      "pnl": 217.91615289767,
      "points": 3.40836428571447,
      "reason": "tp",
      "side": "long",
      "size": 63.9356989541948,
      "sl": 1888.56400142857,
      "tag": "DSL-SBH:AH",
      "tp": 1891.98636428571
    },
    {
      "entry": 1900.915,
      "entryIndex": 1036,
      "entryT": 1604404800000,
      "exit": 1904.73588571429,
      "exitIndex": 1041,
      "exitT": 1604409300000,
      "initialSl": 1897.42814285714,
      "initialTp": 1904.79588571429,
      "meta": {
        "gradeRequired": 0,
        "gradeScore": 0,
        "levelKey": "AH",
        "levelPrice": 1898.508,
        "setup": "sessionBreakHold",
        "side": "long"
      },
      "pnl": 219.159292035406,
      "points": 3.82088571428562,
      "reason": "tp",
      "side": "long",
      "size": 57.3582431989546,
      "sl": 1897.42814285714,
      "tag": "DSL-SBH:AH",
      "tp": 1904.79588571429
    },
    {
      "entry": 1873.725,
      "entryIndex": 1586,
      "entryT": 1605094200000,
      "exit": 1875.90257142857,
      "exitIndex": 1587,
      "exitT": 1605095100000,
      "initialSl": 1875.84257142857,
      "initialTp": 1871.41879285714,
      "meta": {
        "gradeRequired": 0,
        "gradeScore": 0,
        "levelKey": "AL",
        "levelPrice": 1874.468,
        "setup": "sessionBreakHold",
        "side": "short"
      },
      "pnl": -205.666869054842,
      "points": -2.17757142857135,
      "reason": "sl",
      "side": "short",
      "size": 94.4478175807875,
      "sl": 1875.84257142857,
      "tag": "DSL-SBH:AL",
      "tp": 1871.41879285714
    },
    {
      "entry": 1885.838,
      "entryIndex": 1775,
      "entryT": 1605271500000,
      "exit": 1891.65594285714,
      "exitIndex": 1778,
      "exitT": 1605274200000,
      "initialSl": 1880.61457142857,
      "initialTp": 1891.71594285714,
      "meta": {
        "gradeRequired": 0,
        "gradeScore": 0,
        "levelKey": "AH",
        "levelPrice": 1881.865,
        "setup": "sessionBreakHold",
        "side": "long"
      },
      "pnl": 222.763373810313,
      "points": 5.81794285714295,
      "reason": "tp",
      "side": "long",
      "size": 38.2890274587032,
      "sl": 1880.61457142857,
      "tag": "DSL-SBH:AH",
      "tp": 1891.71594285714
    }
  ]
}
