{
  "case": "family-legacy-setup9",
  "costs": {
    "feePerUnit": 0,
    "fillOn": "close",
    "slippage": 0.05,
    "startEquity": 10000
  },
  "higherTimeframe": "1d",
  "rangeMethod": "zone",
  "schema": "dsl-conformance-trades-v1",
  "strategyId": "legacy-setup9",
  "symbol": "XAUUSD",
  "timeframe": "1h",
  "tradeCount": 3,
  "trades": [
    {
      "entry": 111.95,
      "entryIndex": 12,
      "entryT": 1767614400000,
      "exit": 114.05,
      "exitIndex": 13,
      "exitT": 1767618000000,
      "initialSl": 114,
      "initialTp": 108,
      "meta": {
        "profile": "seq.legacy.setup9.v1",
        "setup": "legacySetup9",
        "signalAtr": 2,
        "signalIndex": 12
      },
      "pnl": -204.878048780488,
      "points": -2.09999999999999,
      "reason": "sl",
      "side": "short",
      "size": 97.5609756097562,
      "sl": 114,
      "tag": "TD-SELL-9",
      "tp": 108
    },
    {
      "entry": 350.05,
      "entryIndex": 250,
      "entryT": 1768471200000,
      "exit": 353.95,
      "exitIndex": 253,
      "exitT": 1768482000000,
      "initialSl": 348,
      "initialTp": 354,
      "meta": {
        "profile": "seq.legacy.setup9.v1",
        "setup": "legacySetup9",
        "signalAtr": 2,
        "signalIndex": 250
      },
      "pnl": 380.487804878044,
      "points": 3.89999999999998,
      "reason": "tp",
      "side": "long",
      "size": 97.5609756097556,
      "sl": 348,
      "tag": "TD-BUY-9",
      "tp": 354
    },
    {
      "entry": 367.95,
      "entryIndex": 268,
      "entryT": 1768536000000,
      "exit": 370.05,
      "exitIndex": 269,
      "exitT": 1768539600000,
      "initialSl": 370,
      "initialTp": 364,
      "meta": {
        "profile": "seq.legacy.setup9.v1",
        "setup": "legacySetup9",
        "signalAtr": 2,
        "signalIndex": 268
      },
      "pnl": -204.878048780489,
      "points": -2.10000000000002,
      "reason": "sl",
      "side": "short",
      "size": 97.5609756097556,
      "sl": 370,
      "tag": "TD-SELL-9",
      "tp": 364
    }
  ]
}
