{
  "case": "family-sma-golden-cross",
  "costs": {
    "feePerUnit": 0,
    "fillOn": "close",
    "slippage": 0.06,
    "startEquity": 10000
  },
  "higherTimeframe": "1d",
  "rangeMethod": "zone",
  "schema": "dsl-conformance-trades-v1",
  "strategyId": "dslSmaGoldenCrossXauusdDaily",
  "symbol": "XAUUSD",
  "timeframe": "4h",
  "tradeCount": 13,
  "trades": [
    {
      "entry": 362.355,
      "entryIndex": 312,
      "entryT": 1059494400000,
      "exit": 373.029,
      "exitIndex": 620,
      "exitT": 1066104000000,
      "initialSl": null,
      "initialTp": null,
      "meta": {
        "fastSma": 352.16546,
        "setup": "smaGoldenCross",
        "signalIndex": 311,
        "slowSma": 352.1378
      },
      "pnl": 10.674,
      "points": 10.674,
      "reason": "sma-bearish-cross",
      "side": "long",
      "size": 1,
      "sl": null,
      "tag": "DSL-SMA-GC",
      "tp": null
    },
    {
      "entry": 385.244,
      "entryIndex": 678,
      "entryT": 1067313600000,
      "exit": 407.946,
      "exitIndex": 1045,
      "exitT": 1074873600000,
      "initialSl": null,
      "initialTp": null,
      "meta": {
        "fastSma": 378.7439,
        "setup": "smaGoldenCross",
        "signalIndex": 677,
        "slowSma": 378.689885
      },
      "pnl": 22.7019999999999,
      "points": 22.7019999999999,
      "reason": "sma-bearish-cross",
      "side": "long",
      "size": 1,
      "sl": null,
      "tag": "DSL-SMA-GC",
      "tp": null
    },
    {
      "entry": 411.346,
      "entryIndex": 1274,
      "entryT": 1079712000000,
      "exit": 396.956,
      "exitIndex": 1399,
      "exitT": 1082462400000,
      "initialSl": null,
      "initialTp": null,
      "meta": {
        "fastSma": 402.00754,
        "setup": "smaGoldenCross",
        "signalIndex": 1273,
        "slowSma": 401.982245
      },
      "pnl": -14.39,
      "points": -14.39,
      "reason": "sma-bearish-cross",
      "side": "long",
      "size": 1,
      "sl": null,
      "tag": "DSL-SMA-GC",
      "tp": null
    },
    {
      "entry": 394.284,
      "entryIndex": 1573,
      "entryT": 1086105600000,
      "exit": 389.307,
      "exitIndex": 1814,
      "exitT": 1091073600000,
      "initialSl": null,
      "initialTp": null,
      "meta": {
        "fastSma": 388.12626,
        "setup": "smaGoldenCross",
        "signalIndex": 1572,
        "slowSma": 388.069395
      },
      "pnl": -4.97699999999998,
      "points": -4.97699999999998,
      "reason": "sma-bearish-cross",
      "side": "long",
      "size": 1,
      "sl": null,
      "tag": "DSL-SMA-GC",
      "tp": null
    },
    {
      "entry": 403.784,
      "entryIndex": 1894,
      "entryT": 1092787200000,
      "exit": 438.356,
      "exitIndex": 2400,
      "exitT": 1103256000000,
      "initialSl": null,
      "initialTp": null,
      "meta": {
        "fastSma": 396.98674,
        "setup": "smaGoldenCross",
        "signalIndex": 1893,
        "slowSma": 396.81684
      },
      "pnl": 34.572,
      "points": 34.572,
      "reason": "sma-bearish-cross",
      "side": "long",
      "size": 1,
      "sl": null,
      "tag": "DSL-SMA-GC",
      "tp": null
    },
    {
      "entry": 426.86,
      "entryIndex": 2667,
      "entryT": 1109016000000,
      "exit": 426.202,
      "exitIndex": 2815,
      "exitT": 1112083200000,
      "initialSl": null,
      "initialTp": null,
      "meta": {
        "fastSma": 421.6848,
        "setup": "smaGoldenCross",
        "signalIndex": 2666,
        "slowSma": 421.677145
      },
      "pnl": -0.658000000000015,
      "points": -0.658000000000015,
      "reason": "sma-bearish-cross",
      "side": "long",
      "size": 1,
      "sl": null,
      "tag": "DSL-SMA-GC",
      "tp": null
    },
    {
      "entry": 435.763,
      "entryIndex": 2936,
      "entryT": 1114574400000,
      "exit": 424.967,
      "exitIndex": 3001,
      "exitT": 1115884800000,
      "initialSl": null,
      "initialTp": null,
      "meta": {
        "fastSma": 430.57946,
        "setup": "smaGoldenCross",
        "signalIndex": 2935,
        "slowSma": 430.439675
      },
      "pnl": -10.796,
      "points": -10.796,
      "reason": "sma-bearish-cross",
      "side": "long",
      "size": 1,
      "sl": null,
      "tag": "DSL-SMA-GC",
      "tp": null
    },
    {
      "entry": 426.34,
      "entryIndex": 3134,
      "entryT": 1118736000000,
      "exit": 426.89,
      "exitIndex": 3250,
      "exitT": 1121155200000,
      "initialSl": null,
      "initialTp": null,
      "meta": {
        "fastSma": 423.2878,
        "setup": "smaGoldenCross",
        "signalIndex": 3133,
        "slowSma": 423.247735
      },
      "pnl": 0.550000000000011,
      "points": 0.550000000000011,
      "reason": "sma-bearish-cross",
      "side": "long",
      "size": 1,
      "sl": null,
      "tag": "DSL-SMA-GC",
      "tp": null
    },
    {
      "entry": 437.161,
      "entryIndex": 3352,
      "entryT": 1123200000000,
      "exit": 462.742,
      "exitIndex": 3723,
      "exitT": 1130976000000,
      "initialSl": null,
      "initialTp": null,
      "meta": {
        "fastSma": 428.8628,
        "setup": "smaGoldenCross",
        "signalIndex": 3351,
        "slowSma": 428.83555
      },
      "pnl": 25.581,
      "points": 25.581,
      "reason": "sma-bearish-cross",
      "side": "long",
      "size": 1,
      "sl": null,
      "tag": "DSL-SMA-GC",
      "tp": null
    },
    {
      "entry": 484.755,
      "entryIndex": 3788,
      "entryT": 1132286400000,
      "exit": 547.351,
      "exitIndex": 4164,
      "exitT": 1140134400000,
      "initialSl": null,
      "initialTp": null,
      "meta": {
        "fastSma": 468.33794,
        "setup": "smaGoldenCross",
        "signalIndex": 3787,
        "slowSma": 467.95982
      },
      "pnl": 62.596,
      "points": 62.596,
      "reason": "sma-bearish-cross",
      "side": "long",
      "size": 1,
      "sl": null,
      "tag": "DSL-SMA-GC",
      "tp": null
    },
    {
      "entry": 568.223,
      "entryIndex": 4223,
      "entryT": 1141358400000,
      "exit": 538.627,
      "exitIndex": 4255,
      "exitT": 1142006400000,
      "initialSl": null,
      "initialTp": null,
      "meta": {
        "fastSma": 556.47512,
        "setup": "smaGoldenCross",
        "signalIndex": 4222,
        "slowSma": 556.42544
      },
      "pnl": -29.5959999999999,
      "points": -29.5959999999999,
      "reason": "sma-bearish-cross",
      "side": "long",
      "size": 1,
      "sl": null,
      "tag": "DSL-SMA-GC",
      "tp": null
    },
    {
      "entry": 561.757,
      "entryIndex": 4316,
      "entryT": 1143446400000,
      "exit": 652.084,
      "exitIndex": 4589,
      "exitT": 1149062400000,
      "initialSl": null,
      "initialTp": null,
      "meta": {
        "fastSma": 552.10296,
        "setup": "smaGoldenCross",
        "signalIndex": 4315,
        "slowSma": 552.08141
      },
      "pnl": 90.3270000000001,
      "points": 90.3270000000001,
      "reason": "sma-bearish-cross",
      "side": "long",
      "size": 1,
      "sl": null,
      "tag": "DSL-SMA-GC",
      "tp": null
    },
    {
      "entry": 621.824,
      "entryIndex": 4752,
      "entryT": 1152532800000,
      "exit": 613.425,
      "exitIndex": 4919,
      "exitT": 1155873600000,
      "initialSl": null,
      "initialTp": null,
      "meta": {
        "fastSma": 612.62648,
        "setup": "smaGoldenCross",
        "signalIndex": 4751,
        "slowSma": 611.696915
      },
      "pnl": -8.39899999999989,
      "points": -8.39899999999989,
      "reason": "sma-bearish-cross",
      "side": "long",
      "size": 1,
      "sl": null,
      "tag": "DSL-SMA-GC",
      "tp": null
    }
  ]
}
