{
  "case": "family-clock-range-breakout-fractional-offset-minus-3-30",
  "costs": {
    "feePerUnit": 0,
    "fillOn": "close",
    "slippage": 0,
    "startEquity": 10000
  },
  "higherTimeframe": null,
  "rangeMethod": "zone",
  "schema": "dsl-conformance-trades-v1",
  "strategyId": "family-clock-range-breakout-fractional-offset-minus-3-30",
  "symbol": "XAUUSD",
  "timeframe": "5m",
  "tradeCount": 1,
  "trades": [
    {
      "entry": 101,
      "entryIndex": 36,
      "entryT": 1773156900000,
      "exit": 102,
      "exitIndex": 37,
      "exitT": 1773185400000,
      "initialSl": 99.99,
      "initialTp": null,
      "meta": {
        "clockRangeBreakout": {
          "dayKey": "2026-03-10",
          "exitReason": "clock",
          "orderPlacedAt": 1773156900000,
          "rangeBars": 36,
          "rangeHigh": 101,
          "rangeLow": 99,
          "side": "long"
        }
      },
      "pnl": 198.019801980198,
      "points": 1,
      "reason": "rule",
      "rule": "clock-range-close",
      "side": "long",
      "size": 198.019801980198,
      "sl": 99.99,
      "tag": "DSL-CRB",
      "tp": null
    }
  ]
}
