{
  "case": "family-sequential-full-e1-short",
  "costs": {
    "feePerUnit": 0,
    "fillOn": "open",
    "slippage": 0,
    "startEquity": 10000
  },
  "higherTimeframe": null,
  "rangeMethod": "zone",
  "schema": "dsl-conformance-trades-v1",
  "sequentialFull": {
    "opportunities": [
      {
        "capBinds": false,
        "decisionIndex": 13,
        "decisionMs": 4200000,
        "decisionOpenMs": 3900000,
        "episodeId": "seq.full.public_approx.v1:SYNTH:5m:sell:3900000",
        "fill": 100,
        "fillIndex": 14,
        "id": "seq.full.public_approx.v1:SYNTH:5m:sell:3900000:perf",
        "nextOpenIndex": 14,
        "riskDistance": 10.207142857142856,
        "setupFirstIndex": 5,
        "setupIndex": 13,
        "side": "short",
        "signalAtr": 2.0714285714285716,
        "size": 9.797060881735481,
        "status": "filled",
        "stop": 110.20714285714286,
        "target": 79.58571428571429,
        "trigger": "perf"
      }
    ],
    "policy": "E1",
    "profile": "seq.full.public_approx.v1",
    "schema": "sequential-full-execution.v1",
    "symbol": "SYNTH",
    "timeframe": "5m"
  },
  "strategyId": "family-sequential-full-e1-short",
  "symbol": "SYNTH",
  "timeframe": "5m",
  "tradeCount": 1,
  "trades": [
    {
      "entry": 100,
      "entryIndex": 14,
      "entryT": 4200000,
      "exit": 100,
      "exitIndex": 18,
      "exitT": 5400000,
      "initialSl": 110.207142857143,
      "initialTp": 79.5857142857143,
      "meta": {
        "episodeId": "seq.full.public_approx.v1:SYNTH:5m:sell:3900000",
        "opportunityId": "seq.full.public_approx.v1:SYNTH:5m:sell:3900000:perf",
        "policy": "E1",
        "profile": "seq.full.public_approx.v1",
        "signalAtr": 2.07142857142857,
        "signalIndex": 13
      },
      "pnl": 0,
      "points": 0,
      "reason": "time",
      "side": "short",
      "size": 9.79706088173548,
      "sl": 110.207142857143,
      "tag": "SEQUENTIAL-E1",
      "tp": 79.5857142857143
    }
  ]
}
