{
  "case": "deployed-dsl-close-vwap-extreme-magnet-defensive",
  "costs": {
    "feePerUnit": 0,
    "fillOn": "close",
    "slippage": 0.06,
    "startEquity": 10000
  },
  "higherTimeframe": "1h",
  "rangeMethod": "zone",
  "schema": "dsl-conformance-trades-v1",
  "strategyId": "dslCloseVwapExtremeMagnetDefensive",
  "symbol": "XAUUSD",
  "timeframe": "15m",
  "tradeCount": 3,
  "trades": [
    {
      "entry": 2627.975,
      "entryIndex": 479,
      "entryT": 1736150400000,
      "exit": 2628.04591071429,
      "exitIndex": 481,
      "exitT": 1736152200000,
      "initialSl": 2624.37651785714,
      "initialTp": 2636.82065712947,
      "meta": {
        "gradeRequired": 0,
        "gradeScore": 0,
        "levelKey": "VWAP",
        "levelPrice": 2636.82065712947,
        "regime": "choppy",
        "sessionPhase": "close",
        "setup": "vwapExtensionFade",
        "setupAgeCandles": 0,
        "side": "long",
        "targetMode": "vwap",
        "targetR": 2.51680148999635,
        "vwap": 2636.82065712947,
        "vwapDistanceAtr": -3.38113084237466
      },
      "pnl": 3.94114582040786,
      "points": 0.0709107142856737,
      "reason": "sl",
      "side": "long",
      "size": 55.5789891571308,
      "sl": 2628.10591071429,
      "tag": "DSL-VEF:VWAP",
      "tp": 2636.82065712947
    },
    {
      "entry": 2672.774,
      "entryIndex": 775,
      "entryT": 1736427600000,
      "exit": 2675.85098214286,
      "exitIndex": 776,
      "exitT": 1736428500000,
      "initialSl": 2675.79098214286,
      "initialTp": 2663.45361187151,
      "meta": {
        "gradeRequired": 0,
        "gradeScore": 0,
        "levelKey": "VWAP",
        "levelPrice": 2663.45361187151,
        "regime": "choppy",
        "sessionPhase": "close",
        "setup": "vwapExtensionFade",
        "setupAgeCandles": 0,
        "side": "short",
        "targetMode": "vwap",
        "targetR": 3.17228433426585,
        "vwap": 2663.45361187151,
        "vwapDistanceAtr": 3.15633027612806
      },
      "pnl": -203.977484596122,
      "points": -3.0769821428571,
      "reason": "sl",
      "side": "short",
      "size": 66.2914099354247,
      "sl": 2675.79098214286,
      "tag": "DSL-VEF:VWAP",
      "tp": 2663.45361187151
    },
    {
      "entry": 2715.135,
      "entryIndex": 1238,
      "entryT": 1737035100000,
      "exit": 2714.96696071429,
      "exitIndex": 1244,
      "exitT": 1737040500000,
      "initialSl": 2719.23871428571,
      "initialTp": 2701.11060728884,
      "meta": {
        "gradeRequired": 0,
        "gradeScore": 0,
        "levelKey": "VWAP",
        "levelPrice": 2701.11060728884,
        "regime": "choppy",
        "sessionPhase": "close",
        "setup": "vwapExtensionFade",
        "setupAgeCandles": 0,
        "side": "short",
        "targetMode": "vwap",
        "targetR": 3.48303359634413,
        "vwap": 2701.11060728884,
        "vwapDistanceAtr": 3.55410053994628
      },
      "pnl": 8.18961916034181,
      "points": 0.168039285714258,
      "reason": "sl",
      "side": "short",
      "size": 48.7363364199716,
      "sl": 2714.90696071429,
      "tag": "DSL-VEF:VWAP",
      "tp": 2701.11060728884
    }
  ]
}
